tanggal,sumber (url),judul berita,konten,politik,hukum,nasional,jumlah label
2025-07-25,https://news.detik.com/berita/d-8028953/massa-gelar-aksi-dukung-hakim-vonis-penjara-hasto-di-pn-jakpus,Massa Gelar Aksi Dukung Hakim Vonis Penjara Hasto di PN Jakpus,Sekjen PDIP Hasto Kristiyanto menghadapi sidang vonis kasus dugaan suap pengurusan pergantian antarwaktu (PAW) anggota DPR untuk Harun Masiku dan perintangan penyidikan hari ini,1,1,0,6
2025-04-03,https://news.detik.com/berita/d-7853101/kesepakatan-pertemuan-prabowo-dan-megawati-secepatnya,Kesepakatan Pertemuan Prabowo dan Megawati Secepatnya,Pertemuan Presiden sekaligus Ketum Partai Gerindra Prabowo Subianto dan Presiden RI ke-5 sekaligus Ketum PDIP Megawati Soekarnoputri secepatnya akan terlaksana,1,0,0,2
2025-04-09,https://news.detik.com/berita/d-7860227/demokrat-puji-prabowo-temui-megawati-di-teuku-umar-kedewasaan-politik,Demokrat Puji Prabowo Temui Megawati di Teuku Umar: Kedewasaan Politik,Presiden Prabowo Subianto bertemu dengan Presiden ke-5 RI sekaligus Ketum PDIP Megawati Soekarnoputri,1,0,0,2
2025-05-20,https://news.detik.com/foto-news/d-7923950/oso-buka-munaslub-lasmura-perkuat-barisan-generasi-muda,"Oso Buka Munaslub Lasmura, Perkuat Barisan Generasi Muda",Jakarta - Laskar Muda Hanura (LASMURA) menggelar Musyawarah Nasional Luar Biasa (Munaslub),0,0,1,1
2024-08-26,https://news.detik.com/berita/d-7508519/prabowo-bilang-intel-jangan-ngintelin-lawan-politik-ini-kata-pdip,"Prabowo Bilang Intel Jangan Ngintelin Lawan Politik, Ini Kata PDIP","Presiden terpilih Prabowo Subianto mengatakan bahwa intel harus digunakan untuk kepentingan bangsa, bukan untuk ngintelin lawan politik",1,0,0,2
2025-05-26,https://news.detik.com/berita/d-7934051/dikaitkan-ke-isu-judol-pdip-ultimatum-budi-arie-minta-maaf-1x24-jam,"Dikaitkan ke Isu Judol, PDIP Ultimatum Budi Arie Minta Maaf 1x24 Jam!","Anggota Komisi VI DPR RI Fraksi PDI Perjuangan, Sadarestuwati, meminta Menteri Perekonomian (Menkop) Budi Arie meminta maaf ke partainya lantaran dikaitkan dengan isu judi online",1,0,0,2
2025-04-25,https://news.detik.com/berita/d-7884953/kejari-jakpus-geledah-4-lokasi-terkait-korupsi-proyek-pusat-data-nasional,Kejari Jakpus Geledah 4 Lokasi Terkait Korupsi Proyek Pusat Data Nasional,Kejaksaan Negeri Jakarta Pusat (Kejari Jakpus) melakukan penggeledahan di 4 lokasi terkait kasus dugaan korupsi Pengadaan Barang/Jasa dan Pengelolaan Pusat Data Nasional Sementara (PDNS) Kementerian Komunikasi dan Informatika (Kominfo) Tahun 2020-2024,1,1,1,7
2025-05-25,https://news.detik.com/foto-news/d-7932052/foto-udara-jalan-amblas-di-poros-samarinda-balikpapan-puluhan-rumah-dan-masjid-rusak-parah,"Foto Udara Jalan Amblas di Poros Samarinda-Balikpapan, Puluhan Rumah dan Masjid Rusak Parah","Kalimantan Timur - Foto udara memperlihatkan jalan yang amblas di jalan Poros Samarinda-Balikpapan, Desa Batuah, Kecamatan Loa Janan, Kabupaten Kutai Kartanegara, Minggu (25/50",0,0,1,1
2025-06-08,https://news.detik.com/internasional/d-7954453/trump-kerahkan-2-000-pasukan-garda-nasional-buat-atasi-demo-soal-imigrasi,Trump Kerahkan 2.000 Pasukan Garda Nasional Buat Atasi Demo Soal Imigrasi,Aksi protes terhadap kebijakan imigrasi Presiden Amerika Serikat (AS) Donald Trump di Los Angeles pecah,1,1,0,6
2025-03-09,https://news.detik.com/berita/d-7811994/hari-musik-nasional-diperingati-9-maret-begini-latar-belakangnya,"Hari Musik Nasional Diperingati 9 Maret, Begini Latar Belakangnya",Tanggal 9 Maret diperingati sebagai Hari Musik Nasional di Indonesia,0,0,1,1
2025-04-05,https://news.detik.com/berita/d-7855639/ksal-janji-proses-hukum-prajurit-pembunuh-jurnalis-tak-bertele-tele,KSAL Janji Proses Hukum Prajurit Pembunuh Jurnalis Tak Bertele-tele,"Kepala Staf Angkatan Laut (KSAL) Laksamana Muhammad Ali menegaskan akan memproses Jumran, prajurit TNI AL terduga pembunuh dan pemerkosa wartawati di Banjarbaru, Kalimantan Selatan (Kalsel)",0,0,0,0
2025-07-18,https://news.detik.com/berita/d-8018094/tom-lembong-divonis-4-5-tahun-penjara,"Tom Lembong Divonis 4,5 Tahun Penjara!",Mantan Menteri Perdagangan Thomas Trikasih Lembong alias Tom Lembong divonis hukuman penjara,1,1,0,6
2025-07-14,https://news.detik.com/berita/d-8009873/kabar-jokowi-sehat-walafiat-usai-liburan-diungkap-ajudan,Kabar Jokowi Sehat Walafiat Usai Liburan Diungkap Ajudan,Presiden ke-7 RI Joko Widodo (Jokowi) dikabarkan dalam kondisi yang sehat walafiat,1,0,0,2
2025-07-30,https://news.detik.com/berita/d-8036358/puan-buka-bimtek-pdip-di-bali-tak-cukup-lagi-modal-teriak-merdeka,Puan Buka Bimtek PDIP di Bali: Tak Cukup Lagi Modal Teriak Merdeka,Ketua DPP PDIP Puan Maharani resmi membuka rangkaian bimbingan teknis (bimtek) DPR dan DPRD provinsi/kabupaten/kota fraksi PDIP di Bali,1,0,0,2
2024-08-28,https://news.detik.com/berita/d-7512937/ikut-tes-capim-kpk-korban-twk-ngaku-diuji-cara-hadapi-tekanan-politik,"Ikut Tes Capim KPK, Korban TWK Ngaku Diuji Cara Hadapi Tekanan Politik",Eks pegawai KPK Giri Suprapdiono menjadi salah satu peserta tes asesmen calon pimpinan (capim) KPK,0,0,0,0
2025-06-23,https://news.detik.com/internasional/d-7978045/iran-hukum-gantung-pria-yang-dituduh-jadi-mata-mata-israel,Iran Hukum Gantung Pria yang Dituduh Jadi Mata-mata Israel,Otoritas Iran telah melaksanakan hukuman gantung terhadap seorang pria yang dinyatakan bersalah telah menjadi mata-mata untuk Israel,0,1,0,4
2025-04-25,https://news.detik.com/dw/d-7885060/memanas-jelang-pemilu-korsel-hadapi-ketegangan-politik,"Memanas Jelang Pemilu, Korsel Hadapi Ketegangan Politik","Setelah krisis darurat militer yang mengguncang di bawah mantan Presiden Yoon Suk Yeol, Korea Selatan kini menghadapi pemilihan umum yang penuh ketegangan pada 3 Juni",1,0,0,2
2025-07-15,https://news.detik.com/berita/d-8012878/jokowi-curiga-ada-agenda-besar-politik-aria-bima-singgung-narasi-tak-jelas,"Jokowi Curiga Ada Agenda Besar Politik, Aria Bima Singgung Narasi Tak Jelas",Politikus PDIP Aria Bima menanggapi pernyataan Presiden ke-7 RI Joko Widodo (Jokowi) yang curiga adanya agenda besar di balik polemik ijazah dan pemakzulan Wapres Gibran Rakabuming Raka,1,0,0,2
2025-07-07,https://news.detik.com/internasional/d-7999007/trump-kecam-elon-musk-bikin-partai-politik-baru-konyol,Trump Kecam Elon Musk Bikin Partai Politik Baru: Konyol!,"Presiden Amerika Serikat (AS) Donald Trump mengecam partai politik baru yang diluncurkan orang terkaya di dunia, Elon Musk",1,0,0,2
2024-12-26,https://news.detik.com/berita/d-7704292/tahun-politik-di-2024-dinamika-pemilu-hingga-prabowo-gibran-dilantik,Tahun Politik di 2024: Dinamika Pemilu hingga Prabowo-Gibran Dilantik,Sepanjang 2024 menjadi tahun politik bagi Tanah Air,1,0,0,2
2025-07-22,https://news.detik.com/berita/d-8022848/tom-lembong-banding-jaksa-tak-bergeming,"Tom Lembong Banding, Jaksa Tak Bergeming","Mantan Menteri Perdagangan Thomas Trikasih Lembong atau Tom Lembong mengajukan banding atas vonis 4,5 tahun penjara dalam kasus impor gula",1,1,0,6
2025-06-07,https://news.detik.com/foto-news/d-7953508/momen-menhan-dan-menkeu-tinjau-garis-depan-papua,Momen Menhan dan Menkeu Tinjau Garis Depan Papua,Papua - Menhan dan Menkeu mengunjungi wilayah konflik di Papua,0,0,0,0
2025-03-13,https://news.detik.com/berita/d-7822187/ahli-hukum-ub-apresiasi-kapolri-tindak-tegas-eks-kapolres-ngada,Ahli Hukum UB Apresiasi Kapolri Tindak Tegas Eks Kapolres Ngada,"Ahli hukum dari Universitas Brawijaya, Aan Eko Widiarto, mengapresiasi Kapolri Jenderal Listyo Sigit Prabowo yang menindak tegas kasus narkoba dan asusila yang melibatkan mantan Kapolres Ngada AKBP Fajar Widyadharma Lukman Sumaatmaja",0,0,0,0
2025-07-25,https://news.detik.com/foto-news/d-8027350/ada-perbaikan-jalan-jalur-gunung-gumitir-ditutup-hingga-akhir-september,"Ada Perbaikan Jalan, Jalur Gunung Gumitir Ditutup Hingga Akhir September",Jember - Jalur nasional Gunung Gumitir di Jember ditutup total hingga 24 September 2025,0,0,1,1
2025-03-07,https://news.detik.com/berita/d-7812509/bamsoet-raih-predikat-mahasiswa-berprestasi-dalam-kancah-politik-nasional,Bamsoet Raih Predikat Mahasiswa Berprestasi dalam Kancah Politik Nasional,Anggota Komisi III DPR RI sekaligus Wakil Ketua Umum Partai Golkar Bambang Soesatyo raih Predikat 'Mahasiswa Berprestasi dalam Kancah Politik Nasional' dari Program Pascasarjana Universitas Jayabaya bersama mantan Wakil Gubernur DKI Jakarta Mayor Jenderal TNI (Purn) Prijanto,1,0,1,3
2025-07-15,https://news.detik.com/foto-news/d-8012544/penandatanganan-mou-dewan-pers-dan-kejagung,Penandatanganan MoU Dewan Pers dan Kejagung,Jakarta - Dewan Pers dan Kejaksaan Agung teken nota kesepahaman terkait penegakan hukum,0,1,0,4
2025-03-27,https://news.detik.com/berita/d-7844378/jokowi-dikit-dikit-bicara-politik-saat-buka-puasa-bersama-prabowo-bahas-apa,"Jokowi Dikit-dikit Bicara Politik Saat Buka Puasa Bersama Prabowo, Bahas Apa?","Presiden ke-7 RI Joko Widodo (Jokowi) sempat menghadiri undangan buka puasa dengan Presiden Prabowo Subianto di Istana Negara, Jakarta",1,0,1,3
2025-07-19,https://news.detik.com/internasional/d-8019381/iran-hukum-gantung-3-pria-pelaku-pemerkosaan,Iran Hukum Gantung 3 Pria Pelaku Pemerkosaan,Otoritas Iran melakukan eksekusi mati terhadap tiga pria yang dinyatakan bersalah atas kasus pemerkosaan,0,0,0,0
2025-07-28,https://news.detik.com/berita/d-8033407/wa-mr-k-dibuka-di-sidang-eks-dirut-taspen-ngaku-serba-salah-menjawab,"WA 'Mr K' Dibuka di Sidang, Eks Dirut Taspen Ngaku Serba Salah Menjawab","Jaksa penuntut umum (JPU) mengungkap isi chat antara Direktur Utama PT Tabungan dan Asuransi Pegawai Negeri (Taspen) Persero 2013-2020, Iqbal Latanro, dan Dirut PT Taspen 2020-2024, Antonius NS Kosasih",0,1,0,4
2025-07-18,https://news.detik.com/berita/d-8018230/rangkaian-acara-hari-anak-nasional-2025-ini-agenda-dan-panduannya,"Rangkaian Acara Hari Anak Nasional 2025, Ini Agenda dan Panduannya",Peringatan Hari Anak Nasional (HAN) ke-41 akan digelar pada 23 Juli 2025,0,0,1,1
2025-04-05,https://news.detik.com/berita/d-7855856/kapolri-bicara-kemungkinan-one-way-nasional-arus-balik-lebaran-dipercepat,Kapolri Bicara Kemungkinan One Way Nasional Arus Balik Lebaran Dipercepat,Rekayasa lalu lintas one way nasional dari Km 414 Gerbang Tol Kalikangkung sampai Km 70 Gerbang Tol Cikampek Utama saat arus balik Lebaran 2025 akan diterapkan Minggu (6/4) besok,0,0,1,1
2025-06-20,https://news.detik.com/berita/d-7973540/periksa-bupati-oku-kpk-dalami-perbuatan-melawan-hukum-di-pengadaan-proyek-pupr,"Periksa Bupati OKU, KPK Dalami Perbuatan Melawan Hukum di Pengadaan Proyek PUPR","KPK telah memeriksa Bupati Ogan Komering Ulu (OKU), Teddy Meilwansyah (TM) sebagai saksi terkait kasus dugaan suap dan pemotongan anggaran pada proyek di Dinas PUPR OKU",0,0,0,0
2024-12-10,https://news.detik.com/berita/d-7679790/wamenag-gestur-politik-prabowo-tunjukkan-ciri-demokrasi-indonesia,Wamenag: Gestur Politik Prabowo Tunjukkan Ciri Demokrasi Indonesia,Wakil Menteri Agama (Wamenag) Romo HR Muhammad Syafi'i menekankan pentingnya menjaga suasana kondusif Pilkada 2024,1,0,0,2
2024-11-11,https://news.detik.com/berita/d-7632194/klarifikasi-pihak-anies-soal-foto-dipakai-di-flyer-iuran-partai-perubahan,Klarifikasi Pihak Anies soal Foto Dipakai di Flyer Iuran Partai Perubahan,Anies Baswedan buka suara soal ramai permintaan iuran atau sumbangan yang mengatasnamakan Partai Perubahan,1,0,0,2
2025-01-20,https://news.detik.com/berita/d-7740528/kuasa-hukum-bicara-kemungkinan-pertemuan-luthfi-yasin-dan-andika-hendi,Kuasa Hukum Bicara Kemungkinan Pertemuan Luthfi-Yasin dan Andika-Hendi,"Kuasa hukum pasangan cagub-cawagub Jawa Tengah nomor urut 2 Ahmad Luthfi dan Taj Yasin, Agus Wijayanto, berbicara pertemuan antara Luthfi-Yasin dengan pasangan nomor urut 2, Andika Perkasa-Hendrar Prihadi (Hendi)",0,1,0,4
2025-06-11,https://news.detik.com/berita/d-7959919/ahy-ungkap-prioritas-utama-strategi-infrastruktur-nasional-apa-saja,"AHY Ungkap Prioritas Utama Strategi Infrastruktur Nasional, Apa Saja?","Menteri Koordinator Bidang Infrastruktur dan Pembangunan Kewilayahan, Agus Harimurti Yudhoyono (AHY), menegaskan lima prioritas utama strategi infrastruktur nasional",1,0,1,3
2025-05-10,https://news.detik.com/berita/d-7908227/badan-gizi-nasional-usut-sumber-masalah-171-siswa-bogor-diduga-keracunan-mbg,Badan Gizi Nasional Usut Sumber Masalah 171 Siswa Bogor Diduga Keracunan MBG,"Total siswa TK, SD, dan SMP di Kota Bogor, Jawa Barat, yang diduga keracunan usai mengonsumsi makanan program Makan Bergizi Gratis (MBG) menjadi 171 orang",0,0,0,0
2025-01-15,https://news.detik.com/berita/d-7733130/legislator-nasdem-dorong-proses-hukum-jika-pagar-laut-tangerang-ilegal,Legislator NasDem Dorong Proses Hukum Jika Pagar Laut Tangerang Ilegal,"Anggota Komisi IV DPR Fraksi NasDem Rajiv mengatakan komisinya akan kunjungan kerja spesifik terkait polemik pagar bambu sepanjang 30,16 Km di pantai Tangerang dan 8 Km di pantai Bekasi",1,0,0,2
2024-07-03,https://news.detik.com/pemilu/d-7421802/hendropriyono-soal-politik-dinasti-selama-tak-langgar-hukum-apa-salahnya,"Hendropriyono soal Politik Dinasti: Selama Tak Langgar Hukum, Apa Salahnya?",Mantan Kepala Badan Intelejen Nasional (BIN) Jenderal TNI (Purn) A,0,0,1,1
2025-06-27,https://news.detik.com/berita/d-7984887/daftar-tanggal-merah-2025-usai-27-juni-ini-jadwal-sisa-libur-nasional,"Daftar Tanggal Merah 2025 Usai 27 Juni, Ini Jadwal Sisa Libur Nasional",Informasi tanggal merah setelah libur 27 Juni 2025 cukup banyak dicari usai peringatan Tahun Baru Islam 1447 Hijriah ini,0,0,0,0
2024-08-04,https://news.detik.com/foto-news/d-7472746/potret-layanan-pembuatan-paspor-di-senayan,Potret Layanan Pembuatan Paspor di Senayan,Jakarta - Kementerian Hukum dan Hak Asasi Manusia (Kemenkumham) membuka layanan publik untuk warga Jabodetabek di Senayan,1,0,0,2
2025-07-30,https://news.detik.com/berita/d-8035917/inisial-j-jadi-ketua-dewan-pembina-psi-masih-jadi-misteri,Inisial J Jadi Ketua Dewan Pembina PSI Masih Jadi Misteri,Sosok Ketua Dewan Pembina Partai Solidaritas Indonesia (PSI) masih abu-abu,1,0,1,3
2024-11-15,https://news.detik.com/pilkada/d-7640594/survei-khofifah-49-risma-35-pengamat-politik-sebut-pilkada-jatim-dinamis,"Survei Khofifah 49%, Risma 35%, Pengamat Politik Sebut Pilkada Jatim Dinamis","Pengamat politik yang juga Direktur Eksekutif Lembaga Riset Politik 'Polbrain', Airlangga Pribadi Kusman, menyebut Pilkada Jatim masih akan berlangsung dinamis sampai hari pencoblosan pada 27 November 2024",1,0,0,2
2025-07-22,https://news.detik.com/kolom/d-8023344/jalan-panjang-psi-menuju-perubahan,Jalan Panjang PSI Menuju Perubahan,"Di Solo, Jawa Tengah, Partai Solidaritas Indonesia (PSI) selama dua hari, 19 hingga 20 Juli 2025 tidak hanya menggelar kongres namun di acara itu juga merilis logo baru PSI",1,0,1,3
2025-07-18,https://news.detik.com/berita/d-8018321/eks-direktur-pt-ppi-divonis-4-tahun-penjara-di-kasus-korupsi-impor-gula,Eks Direktur PT PPI Divonis 4 Tahun Penjara di Kasus Korupsi Impor Gula,Mantan Direktur Pengembangan Bisnis PT Perusahaan Perdagangan Indonesia (PPI) Charles Sitorus divonis 4 tahun penjara di kasus korupsi impor gula,0,1,1,5
2024-11-18,https://news.detik.com/pilkada/d-7645235/pwnu-dki-forkabi-dan-fbr-bentuk-satgas-anti-politik-uang-kawal-pilgub-jakarta,"PWNU DKI, Forkabi dan FBR Bentuk Satgas Anti Politik Uang Kawal Pilgub Jakarta",Koalisi Masyarakat Sipil membentuk gerakan anti-money politic atau politik uang untuk mengawal Pilkada Jakarta 2024,1,0,0,2
2025-07-20,https://news.detik.com/berita/d-8020483/kapolri-sma-kemala-taruna-bhayangkara-siapkan-calon-pemimpin-nasional,Kapolri: SMA Kemala Taruna Bhayangkara Siapkan Calon Pemimpin Nasional,Kapolri Jenderal Listyo Sigit Prabowo menjelaskan SMA Kemala Taruna Bhayangkara dipersiapkan untuk mencetak lulusan-lulusan calon pemimpin nasional dan global,0,0,1,1
2024-11-07,https://news.detik.com/berita/d-7626762/parameter-politik-indonesia-dan-voxpol-keluar-dari-persepi,Parameter Politik Indonesia dan Voxpol Keluar dari Persepi,Lembaga survei Parameter Politik Indonesia (PPI) dan Voxpol Center Research and Consulting keluar dari Perkumpulan Survei Opini Publik Indonesia (Persepi),1,0,1,3
2024-08-25,https://news.detik.com/pilkada/d-7508253/safari-partai-politik-anies-baswedan-menuju-pilgub-jakarta,Safari Partai Politik Anies Baswedan Menuju Pilgub Jakarta,Safari politik Anies Baswedan digencarkan menjelang pendaftaran Pilgub Jakarta 2024,1,0,0,2
2025-04-28,https://news.detik.com/berita/d-7889639/as-sdm-kapolri-produksi-jagung-nasional-meningkat-di-triwulan-i-2025,As SDM Kapolri: Produksi Jagung Nasional Meningkat di Triwulan I 2025,"Polri, melalui Gugus Tugas Mendukung Ketahanan Pangan, menyampaikan produksi jagung di skala nasional meningkat pada triwulan pertama 2025",0,1,1,5
2025-07-14,https://news.detik.com/berita/d-8011671/cak-imin-singgung-soal-politik-berbasis-transaksi-jadi-ragu-memposisikan,Cak Imin Singgung soal Politik Berbasis Transaksi: Jadi Ragu Memposisikan,Ketum PKB Muhaimin Iskandar atau Cak Imin menyinggung soal kompetisi politik saat ini yang semakin pragmatis,1,0,0,2
2024-07-31,https://news.detik.com/internasional/d-7466262/pemimpin-hamas-tewas-rusia-pembunuhan-politik-yang-tak-bisa-diterima,"Pemimpin Hamas Tewas, Rusia: Pembunuhan Politik yang Tak Bisa Diterima!","Pemerintah Rusia turut mengomentari kematian pemimpin biro politik Hamas, Ismail Haniyeh, dalam serangan di Iran",1,0,1,3
2025-01-19,https://news.detik.com/berita/d-7739441/pb-hmi-bertemu-menkum-bahas-sinergi-untuk-reformasi-hukum,"PB HMI Bertemu Menkum, Bahas Sinergi untuk Reformasi Hukum",Pengurus Besar Himpunan Mahasiswa Islam (PB HMI) berkunjung ke kantor Kementerian Hukum Republik Indonesia (Kemenkum RI),1,0,1,3
2025-04-21,https://news.detik.com/berita/d-7878640/waisak-nasional-2025-tema-subtema-dan-rangkaian-acaranya,"Waisak Nasional 2025: Tema, Subtema, dan Rangkaian Acaranya",Peringatan Waisak Nasional 2569 BE akan dilaksanakan pada 12 Mei 2025,0,0,1,1
2024-11-01,https://news.detik.com/berita/d-7617178/waka-dpr-soal-wacana-omnibus-law-uu-politik-semua-usulan-ditampung,Waka DPR soal Wacana Omnibus Law UU Politik: Semua Usulan Ditampung,Wakil Ketua DPR RI Adies Kadir menanggapi usulan revisi sejumlah undang-undang (UU) politik via omnibus law,1,0,0,2
2025-07-26,https://news.detik.com/berita/d-8029917/7-pria-perkosa-cabuli-anak-di-pasuruan-pelaku-termasuk-ayah-korban,"7 Pria Perkosa-Cabuli Anak di Pasuruan, Pelaku Termasuk Ayah Korban","Polres Pasuruan menetapkan tujuh orang menjadi tersangka pemerkosaan dan pencabulan terhadap SA, anak perempuan berusia 14 tahun di Pasuruan, Jawa Timur (Jatim)",0,1,0,4
2025-05-09,https://news.detik.com/berita/d-7906660/gedung-mpr-dpr-di-senayan-diusulkan-jadi-cagar-budaya-nasional,Gedung MPR/DPR di Senayan Diusulkan Jadi Cagar Budaya Nasional,"Gedung MPR/DPR RI yang terletak di Senayan, Jakarta, diusulkan naik statusnya menjadi cagar budaya tingkat nasional",1,0,1,3
2025-06-26,https://news.detik.com/berita/d-7983820/kemnaker-dapat-penghargaan-simpul-jaringan-terbaik-nasional-2025-dari-anri,Kemnaker Dapat Penghargaan Simpul Jaringan Terbaik Nasional 2025 dari ANRI,Kementerian Ketenagakerjaan (Kemnaker) mendapatkan penghargaan Simpul Jaringan Terbaik Nasional Tahun 2025 dari Arsip Nasional Republik Indonesia (ANRI),1,0,1,3
2024-11-19,https://news.detik.com/internasional/d-7645932/kantor-politik-hamas-dikabarkan-pindah-dari-qatar-ke-turki-benarkah,"Kantor Politik Hamas Dikabarkan Pindah dari Qatar ke Turki, Benarkah?",Kantor politik kelompok Hamas dikabarkan telah pindah dari Qatar ke Turki,1,0,0,2
2025-07-24,https://news.detik.com/berita/d-8026544/gakkumhut-rilis-capaian-penegakan-hukum-pengendalian-karhutla-mei-juli-2025,Gakkumhut Rilis Capaian Penegakan Hukum-Pengendalian Karhutla Mei-Juli 2025,"Direktorat Jenderal Penegakan Hukum Kehutanan (Ditjen Gakkumhut), Kementerian Kehutanan, menegaskan komitmennya menjaga kelestarian hutan melalui penegakan hukum dan pengendalian kebakaran hutan dan lahan (karhutla)",1,0,0,2
2025-03-28,https://news.detik.com/dw/d-7846378/ekonomi-turki-anjlok-usai-penangkapan-rival-politik-erdogan,Ekonomi Turki Anjlok Usai Penangkapan Rival Politik Erdogan,"Berita tentang penangkapan Ekrem Imamoglu pekan lalu, memicu kerugian besar di pasar modal Turki, dengan banyak investor kehilangan kepercayaan pada kepemimpinan Presiden Recep Tayyip Erdogan",1,0,0,2
2025-01-09,https://news.detik.com/berita/d-7725270/masuk-kerja-di-hari-libur-nasional-simak-ketentuannya,"Masuk Kerja di Hari Libur Nasional, Simak Ketentuannya!",Hari libur nasional yang ditetapkan oleh pemerintah dapat dimanfaatkan oleh pekerja untuk istirahat sejenak dari rutinitas pekerjaan,0,0,1,1
2025-05-17,https://news.detik.com/berita/d-7918686/politik-uang-diungkap-mk-di-pilkada-barito-utara,Politik Uang Diungkap MK di Pilkada Barito Utara,Pasangan nomor urut 1 Gogo Purman Jaga-Hendro Nakalelo dan pasangan nomor urut 2 Akhmad Gunadi-Nadalsyah didiskualifikasi dari kepesertaan Pilbup Barito Utara 2024,0,0,0,0
2025-02-21,https://news.detik.com/berita/d-7789931/bank-jatim-hormati-proses-hukum-kasus-kredit-pastikan-pelayanan-optimal,Bank Jatim Hormati Proses Hukum Kasus Kredit-Pastikan Pelayanan Optimal,"Bank Jatim buka suara terkait penetapan tersangka oleh Kejaksaan Tinggi Daerah Khusus Jakarta (Kejati DK Jakarta) pada tanggal 20 Februari 2025, perihal kasus dugaan manipulasi pemberian kredit yang melibatkan Pemimpin Bank Jatim Cabang Jakarta",0,1,0,4
2024-09-12,https://news.detik.com/berita/d-7538063/hut-fkppi-bamsoet-ingatkan-pentingnya-pembenahan-partai-politik,"HUT FKPPI, Bamsoet Ingatkan Pentingnya Pembenahan Partai Politik",Ketua MPR RI  sekaligus Wakil Ketua Umum FKPPI Bambang Soesatyo (Bamsoet) menekankan bahwa untuk membenahi berbagai permasalahan di Indonesia harus dimulai dengan terlebih dahulu membenahi sistem rekrutmen dan pengkaderan di partai politik,1,0,1,3
2025-01-13,https://news.detik.com/kolom/d-7730131/pertaruhan-format-baru-ujian-nasional,Pertaruhan Format Baru Ujian Nasional,Wacana kembalinya Ujian Nasional (UN) ke sistem pendidikan Indonesia mengundang diskusi kritis di tengah masyarakat,0,0,1,1
2025-06-26,https://news.detik.com/berita/d-7982728/ahli-hukum-ini-nilai-justice-collaborator-dijadikan-pp-kurang-tepat,Ahli Hukum Ini Nilai Justice Collaborator Dijadikan PP Kurang Tepat,Presiden Prabowo Subianto meneken Peraturan Pemerintah Nomor 24 Tahun 2025 yang isinya memberikan penghargaan berupa hukuman ringan hingga bebas bersyarat kepada saksi pelaku tindak pidana yang bersedia bekerja sama dengan penegak hukum untuk mengungkap kasus pidana atau justice collaborator (JC),1,1,1,7
2025-04-19,https://news.detik.com/berita/d-7875781/bawaslu-dalami-dugaan-politik-uang-terkait-penangkapan-12-orang-di-serang,Bawaslu Dalami Dugaan Politik Uang Terkait Penangkapan 12 Orang di Serang,Bawaslu RI menerima laporan operasi tangkap tangan (OTT) terhadap 12 orang diduga melakukan praktek politik uang,1,0,0,2
2025-05-15,https://news.detik.com/kolom/d-7916180/indonesia-emas-di-tengah-gejolak-dan-eskalasi-ekonomi-politik-global,Indonesia Emas di Tengah Gejolak dan Eskalasi Ekonomi Politik Global,"Di tengah ketidakpastian ekonomi-politik global, Indonesia membuka lembaran baru di bawah kepemimpinan Presiden Prabowo Subianto dan Wakil Presiden Gibran Rakabuming Raka",1,0,1,3
2024-12-24,https://news.detik.com/berita/d-7702684/pkn-minta-masyarakat-percaya-ke-kpk-tangani-proses-hukum-hasto,PKN Minta Masyarakat Percaya ke KPK Tangani Proses Hukum Hasto,KPK menetapkan Sekjen PDIP Hasto Kristiyanto sebagai tersangka kasus dugaan suap terhadap mantan Komisioner KPU Wahyu Setiawan,1,1,0,6
2025-06-26,https://news.detik.com/berita/d-7984010/pakar-hukum-bicara-denda-damai-pelaku-korupsi-di-kasus-pajak-hingga-perbankan,Pakar Hukum Bicara Denda Damai Pelaku Korupsi di Kasus Pajak hingga Perbankan,"Guru besar hukum, Pujiyono Suwadi, berbicara tentang denda damai untuk tindak pidana korupsi (tipikor)",0,1,0,4
2024-08-07,https://news.detik.com/foto-news/d-7477305/ini-sosok-yahya-sinwar-yang-jadi-pemimpin-baru-hamas,Ini Sosok Yahya Sinwar yang Jadi Pemimpin Baru Hamas,Palestina - Hamas menunjuk Yahya Sinwar sebagai pemimpin politik barunya menggantikan Ismail Haniyeh yang tewas terbunuh di Teheran,1,0,0,2
2024-09-28,https://news.detik.com/pilkada/d-7562878/panaskan-mesin-politik-pdi-perjuangan-banten-solid-menangkan-airin-ade,"Panaskan Mesin Politik, PDI Perjuangan Banten Solid Menangkan Airin-Ade","DPD PDI Perjuangan Banten menggelar Rapat Kerja Daerah Khusus (Rakerdasus) di Kantor DPD PDI Perjuangan Banten, dan dihadiri oleh ratusan kader mulai dari pengurus DPD, DPC, hingga ranting se-Provinsi Banten",1,0,0,2
2025-02-16,https://news.detik.com/berita/d-7780922/bakal-dilantik-bareng-ayah-anak-pramono-anung-ngaku-tak-ada-ambisi-politik,"Bakal Dilantik Bareng Ayah, Anak Pramono Anung Ngaku Tak Ada Ambisi Politik","Bupati Kediri terpilih, Hanindhito Himawan Permana, akan dilantik sebagai kepala daerah pada 20 Februari mendatang",0,0,0,0
2025-07-24,https://news.detik.com/dw/d-8027509/icj-negara-wajib-lindungi-iklim-atau-dianggap-langgar-hukum,ICJ: Negara Wajib Lindungi Iklim atau Dianggap Langgar Hukum,"Mahkamah Internasional (ICJ) menyatakan bahwa lingkungan yang bersih, sehat, dan berkelanjutan adalah hak asasi manusia",0,1,1,5
2025-02-14,https://news.detik.com/berita/d-7778051/praperadilan-hasto-tak-diterima-icw-status-tersangka-bukan-rekayasa-politik,"Praperadilan Hasto Tak Diterima, ICW: Status Tersangka Bukan Rekayasa Politik","Gugatan praperadilan yang diajukan Sekjen PDIP, Hasto Kristiyanto tidak diterima",0,1,0,4
2025-05-22,https://news.detik.com/berita/d-7926980/menbud-dorong-museum-jadi-pilar-infrastruktur-kebudayaan-nasional,Menbud Dorong Museum Jadi Pilar Infrastruktur Kebudayaan Nasional,"Menteri Kebudayaan RI, Fadli Zon membuka seminar internasional 'SEA Museum Collaboration: Innovating Museum Public Programs for a Rapidly Changing Society'",1,0,1,3
