tanggal,sumber (url),judul berita,konten,politik,hukum,nasional,jumlah label
2025-07-27,https://news.detik.com/berita/d-8031691/hari-anak-nasional-cerebrofort-gelar-pekan-seni-anak-indonesia-pintar,"Hari Anak Nasional, Cerebrofort Gelar Pekan Seni Anak Indonesia Pintar","PT Kalbe Farma Tbk melalui melalui anak usaha PT Saka Farma Laboratories (Kalbe Consumer Health) dan brand Cerebrofort, menggelar Pekan Seni Anak Pintar Indonesia",0,0,1,1
2025-03-15,https://news.detik.com/berita/d-7824755/bahlil-di-ponpes-tasikmalaya-ini-bukan-tahun-politik-tapi-tahun-minta-doa,"Bahlil di Ponpes Tasikmalaya: Ini Bukan Tahun Politik, Tapi Tahun Minta Doa","Ketua Umum Partai Golkar Bahlil Lahadalia bersama jajaran pengurus DPP Partai Golkar melakukan safari Ramadan ke Pondok Pesantren Miftahul Huda Manonjaya, Tasikmalaya, Jawa Barat",1,0,0,2
2025-06-13,https://news.detik.com/berita/d-7962361/ri-kutuk-serangan-israel-ke-iran-pelanggaran-hukum-internasional,RI Kutuk Serangan Israel ke Iran: Pelanggaran Hukum Internasional!,"Pemerintah Indonesia mengutuk serangan militer Israel ke Kota Teheran, Iran, hari ini",0,0,1,1
2025-07-30,https://news.detik.com/berita/d-8036609/sby-negara-kuat-bisa-jatuh-karena-pemimpin-letakkan-diri-di-atas-hukum,SBY: Negara Kuat Bisa Jatuh karena Pemimpin Letakkan Diri di Atas Hukum,Presiden ke-6 RI Susilo Bambang Yudhoyono (SBY) menjelaskan sejumlah faktor suatu negara kuat bisa jatuh,1,0,1,3
2024-11-18,https://news.detik.com/pilkada/d-7644325/cipayung-plus-jakarta-serukan-pilkada-damai-dan-bebas-politik-uang,Cipayung Plus Jakarta Serukan Pilkada Damai dan Bebas Politik Uang,Organisasi Kemasyarakatan dan Pemuda (OKP) Cipayung Plus Jakarta menyerukan Pilkada Jakarta Damai 2024,0,0,0,0
2025-07-26,https://news.detik.com/berita/d-8030295/alasan-hakim-naikkan-hukuman-zarof-ricar-jadi-18-tahun-bui,Alasan Hakim Naikkan Hukuman Zarof Ricar Jadi 18 Tahun Bui,"Pengadilan Tinggi Jakarta memperberat vonis eks pejabat Mahkamah Agung (MA) yang juga dikenal makelar kasus, Zarof Ricar, dari 16 tahun menjadi 18 tahun penjara",0,1,0,4
2025-05-29,https://news.detik.com/berita/d-7934547/hari-lansia-nasional-2025-tema-logo-dan-rangkaian-kegiatannya,"Hari Lansia Nasional 2025: Tema, Logo, dan Rangkaian Kegiatannya",Hari Lanjut Usia Nasional (HLUN) ke-29 akan diperingati pada 29 Mei 2025,0,0,1,1
2024-12-28,https://news.detik.com/berita/d-7707602/jemaat-harap-kehadiran-prabowo-di-perayaan-natal-nasional-pererat-toleransi,Jemaat Harap Kehadiran Prabowo di Perayaan Natal Nasional Pererat Toleransi,"Perayaan Natal Nasional 2024 digelar di Indonesia Arena, GBK, Jakarta, hari ini",0,0,1,1
2024-07-19,https://news.detik.com/pemilu/d-7447080/annisa-pohan-bicara-kehadiran-perempuan-di-politik-demi-kurangi-diskriminasi,Annisa Pohan Bicara Kehadiran Perempuan di Politik demi Kurangi Diskriminasi,"Ketua Umum Srikandi Demokrat Annisa Pohan Yudhoyono mengisi Seminar Perempuan dan Politik yang diadakan Perempuan Demokrat Republik Indonesia (PDRI) di gedung MPR/DPR/DPD RI, Senayan, Jakarta",1,0,1,3
2025-05-22,https://news.detik.com/foto-news/d-7927537/tampang-eks-dirjen-kominfo-cs-ditahan-jaksa-di-kasus-korupsi-pdns,Tampang Eks Dirjen Kominfo Cs Ditahan Jaksa di Kasus Korupsi PDNS,Jakarta - Kejari Jakarta Pusat menetapkan lima tersangka termasuk mantan Dirjen di Kominfo terkait kasus dugaan korupsi proyek Pusat Data Nasional Sementara (PDNS),0,1,1,5
2025-04-18,https://news.detik.com/berita/d-7875334/waka-mpr-bicara-pentingnya-dukungan-tingkatkan-peran-perempuan-di-politik,Waka MPR Bicara Pentingnya Dukungan Tingkatkan Peran Perempuan di Politik,"Wakil Ketua MPR RI, Lestari Moerdijat menegaskan pentingnya dukungan berkelanjutan untuk meningkatkan peran perempuan di dunia politik",1,0,0,2
2025-07-13,https://news.detik.com/berita/d-8009277/ketum-sebut-ormas-gerakan-rakyat-belum-mendesak-dijadikan-parpol,Ketum Sebut Ormas Gerakan Rakyat Belum Mendesak Dijadikan Parpol,Organisasi masyarakat (ormas) Gerakan Rakyat menggelar rapat pimpinan nasional (rapimnas) hari ini,0,0,1,1
2025-04-08,https://news.detik.com/berita/d-7858459/dorongan-dpr-agar-bentrokan-pilkada-di-puncak-jaya-diproses-hukum,Dorongan DPR Agar Bentrokan Pilkada di Puncak Jaya Diproses Hukum,"Bentrokan dua kelompok pendukung calon bupati dan wakil bupati terjadi di Puncak Jaya, Papua jadi sorotan",0,0,0,0
2025-04-15,https://news.detik.com/berita/d-7870146/menkum-ruu-perampasan-aset-menyangkut-politik-perlu-komunikasi-ke-parpol,"Menkum: RUU Perampasan Aset Menyangkut Politik, Perlu Komunikasi ke Parpol","Menteri Hukum (Menkum) RI, Supratman Andi Agtas, menyebut pemerintah terus berupaya agar Rancangan Undang-Undang Perampasan Aset jadi fokus pembahasan di DPR",1,0,1,3
2025-05-27,https://news.detik.com/berita/d-7934871/ace-hasan-soal-dana-parpol-dari-apbn-partai-perlu-perhatian-negara,Ace Hasan soal Dana Parpol dari APBN: Partai Perlu Perhatian Negara,Wakil Ketua KPK Fitroh Rohcahyanto mengusulkan adanya dana tambahan dari pemerintah untuk partai politik melalui anggaran pendapatan belanja negara (APBN),1,0,1,3
2025-02-14,https://news.detik.com/kolom/d-7778770/revitalisasi-institusi-dan-raja-kecil-pada-hierarki-kepemimpinan-nasional,Revitalisasi Institusi dan Raja Kecil pada Hierarki Kepemimpinan Nasional,"Ketika ada 'raja kecil' yang melawan kebijaksanaan pemerintah menerapkan efisiensi anggaran, perlawanan itu menjadi indikator sangat jelas tentang adanya perilaku ambivalen aparatur negara terhadap hierarki kepemimpinan nasional",0,1,1,5
2024-08-10,https://news.detik.com/pemilu/d-7483423/ahy-ultah-ke-46-jubir-demokrat-ceritakan-perjuangan-ahy-di-dunia-politik,"AHY Ultah ke-46, Jubir Demokrat Ceritakan Perjuangan AHY di Dunia Politik",Ketum Partai Demokrat Agus Harimurti Yudhoyono (AHY) ulang tahun ke-46 hari ini,1,0,0,2
2025-06-05,https://news.detik.com/berita/d-7949362/kpk-hadirkan-ahli-hukum-pidana-di-sidang-hasto-kristiyanto-hari-ini,KPK Hadirkan Ahli Hukum Pidana di Sidang Hasto Kristiyanto Hari Ini,Sidang kasus dugaan suap pergantian antarwaktu (PAW) untuk anggota DPR Harun Masiku dan perintangan penyidikan dengan terdakwa Sekjen PDIP Hasto Kristiyanto kembali digelar,1,1,0,6
2024-10-17,https://news.detik.com/berita/d-7592217/keluarga-saya-sedang-diadili-bisakah-minta-bantuan-hukum-gratis,"Keluarga Saya Sedang Diadili, Bisakah Minta Bantuan Hukum Gratis?",Proses di pengadilan bagi masyarakat awam kerap memusingkan,0,1,0,4
2025-02-24,https://news.detik.com/berita/d-7792843/rosan-libatkan-pihak-independen-internasional-nasional-seleksi-tim-danantara,Rosan Libatkan Pihak Independen Internasional-Nasional Seleksi Tim Danantara,Menteri Investasi Rosan Roeslani ditunjuk Presiden Prabowo Subianto menjadi Kepala BPI Danantara,1,0,0,2
2025-07-25,https://news.detik.com/berita/d-8028155/kementerian-imipas-akan-perkuat-transformasi-digital-dan-reformasi-hukum,Kementerian Imipas Akan Perkuat Transformasi Digital dan Reformasi Hukum,Kementerian Imigrasi dan Pemasyarakatan (Kementiran Imipas) terus memperkuat transformasi digital dan reformasi hukum terhadap layanan publik,1,1,0,6
2025-07-20,https://news.detik.com/berita/d-8019820/direktur-ppi-pidato-politik-jokowi-tanda-sudah-resmi-log-in-psi,Direktur PPI: Pidato Politik Jokowi Tanda Sudah Resmi Log In PSI,Presiden ke-7 RI Joko Widodo (Jokowi) menegaskan akan bekerja keras untuk Partai Solidaritas Indonesia (PSI),1,0,1,3
2025-04-21,https://news.detik.com/berita/d-7877836/nyatakan-dukung-prabowo-capres-2029-pan-siap-bicara-pos-wapres,"Nyatakan Dukung Prabowo Capres 2029, PAN Siap Bicara Pos Wapres",Ketum Partai Amanat Nasional (PAN) Zulkifli Hasan (Zulhas) mengatakan partainya siap mendukung Prabowo Subianto maju sebagai capres pada Pilpres 2029,1,0,1,3
2025-07-25,https://news.detik.com/berita/d-8028727/2-pelaku-tawuran-maut-di-matraman-ditangkap-2-lainnya-masih-diburu,"2 Pelaku Tawuran Maut di Matraman Ditangkap, 2 Lainnya Masih Diburu","Polisi masih memburu dua orang terkait tawuran yang menewaskan Nur Hasan (24) di Pisangan Baru, Matraman, Jakarta Timur (Jaktim)",0,0,0,0
2024-09-10,https://news.detik.com/kolom/d-7532006/kelelahan-politik,Kelelahan Politik,Tahun 2024 bakal diingat sebagai salah satu tahun paling riuh dalam riwayat demokrasi kita,0,0,0,0
2025-05-10,https://news.detik.com/berita/d-7909167/pemda-didorong-beri-beasiswa-untuk-kuliah-di-ptn-berbadan-hukum,Pemda Didorong Beri Beasiswa untuk Kuliah di PTN Berbadan Hukum,Menteri Dalam Negeri (Mendagri) Muhammad Tito Karnavian mendorong pemerintah daerah (Pemda) untuk menyalurkan beasiswa bagi pelajar yang ingin melanjutkan pendidikan ke Perguruan Tinggi Negeri Berbadan Hukum (PTN-BH),1,0,1,3
2024-10-27,https://news.detik.com/berita/d-7609188/h-31-pencoblosan-kim-plus-panaskan-mesin-politik-menangkan-luthfi-yasin,"H-31 Pencoblosan, KIM Plus Panaskan Mesin Politik Menangkan Luthfi-Yasin",Ketua DPW PKB Jawa Tengah Yusuf Chudlori (Gus Yusuf) mengatakan Koalisi Indonesia Maju (KIM) Plus di Jawa Tengah sepakat memanaskan mesin partai sebulan jelang pencoblosan,1,0,1,3
2025-04-25,https://news.detik.com/kolom/d-7885098/golkar-dukung-gelar-pahlawan-nasional-untuk-presiden-soeharto,Golkar Dukung Gelar Pahlawan Nasional untuk Presiden Soeharto,Rencana pemerintah memberikan Gelar Pahlawan Nasional ke Presiden Soeharto mendapat beragam reaksi,1,0,1,3
2025-01-01,https://news.detik.com/berita/d-7712611/bos-ppi-apresiasi-kinerja-polri-jaga-situasi-aman-di-tahun-politik,Bos PPI Apresiasi Kinerja Polri Jaga Situasi Aman di Tahun Politik,"Direktur Eksekutif Parameter Politik Indonesia (PPI), Adi Prayitno, mengapresiasi kinerja Polri pada tahun 2024",1,0,1,3
2025-05-20,https://news.detik.com/berita/d-7922541/jokowi-saya-sedih-jika-proses-hukum-soal-ijazah-ke-tahap-berikutnya-kasihan,"Jokowi: Saya Sedih Jika Proses Hukum soal Ijazah ke Tahap Berikutnya, Kasihan",Presiden RI ke-7 Joko Widodo (Jokowi) dimintai keterangan oleh penyidik terkait kasus tudingan ijazah palsu yang tengah diselidiki oleh Bareksrim Polri,1,0,0,2
2024-09-19,https://news.detik.com/berita/d-7548181/paloh-harap-prabowo-prioritaskan-menteri-di-luar-nasdem-ini-etika-politik,Paloh Harap Prabowo Prioritaskan Menteri di Luar NasDem: Ini Etika Politik,Ketua Umum NasDem Surya Paloh berharap Prabowo Subianto-Gibran Rakabuming Raka memprioritaskan menteri untuk partai pendukung yang lain,1,0,0,2
2025-05-18,https://news.detik.com/berita/d-7919522/kadin-dukung-proses-hukum-pemerasan-proyek-rp-5-t-pelaku-akan-dinonaktifkan,"Kadin Dukung Proses Hukum Pemerasan Proyek Rp 5 T, Pelaku Akan Dinonaktifkan","Ketum Kamar Dagang dan Industri (Kadin) Indonesia Anindya Novyan Bakrie mendukung proses hukum kasus pemerasan modus minta jatah proyek Rp 5 triliun oleh Ketua Kadin Kota Cilegon, Muh Salim (54)",0,0,1,1
2025-07-30,https://news.detik.com/kolom/d-8032623/dialektika-hukum-dispensasi-umur-dan-implikasinya-ke-perkawinan-siri-anak,Dialektika Hukum Dispensasi Umur dan Implikasinya ke Perkawinan Siri Anak,Mahkamah Konstitusi mengakhiri bayang kelam anak perempuan Indonesia,0,1,1,5
2025-04-08,https://news.detik.com/berita/d-7858568/one-way-nasional-tol-trans-jawa-resmi-dihentikan-pagi-ini,One Way Nasional Tol Trans Jawa Resmi Dihentikan Pagi Ini,Korlantas Polri resmi memberhentikan rekayasa lalu lintas berupa one way nasional di Tol Trans Jawa yang mengarah ke Jakarta,0,0,1,1
2025-06-13,https://news.detik.com/berita/d-7962262/bamsoet-sebut-politik-uang-masih-jadi-masalah-besar-pemilu-di-ri,Bamsoet Sebut Politik Uang Masih Jadi Masalah Besar Pemilu di RI,Anggota Komisi III DPR RI Bambang Soesatyo mengungkapkan politik uang masih menjadi masalah besar dalam Pemilu di Indonesia,1,0,1,3
2025-07-29,https://news.detik.com/berita/d-8035644/riza-chalid-yang-masih-tak-ada-kabar-berita,Riza Chalid yang Masih Tak Ada Kabar Berita,Mohammad Riza Chalid tersangka kasus dugaan korupsi tata kelola minyak mentah dan produk kilang PT Pertamina mangkir dua panggilan Kejaksaan Agung (Kejagung),0,1,0,4
2025-02-05,https://news.detik.com/berita/d-7764089/menteri-ham-amnesti-diberikan-ke-tahanan-politik-papua-yang-beda-ideologi,Menteri HAM: Amnesti Diberikan ke Tahanan Politik Papua yang Beda Ideologi,Menteri HAM Natalius Pigai mengatakan rencana amnesti tahanan politik di Papua bukan untuk tahanan yang bersenjata,1,1,0,6
2024-12-29,https://news.detik.com/berita/d-7708200/pan-sindir-ada-pihak-nilai-pertemuan-ketum-parpol-prabowo-tak-baik,PAN Sindir Ada Pihak Nilai Pertemuan Ketum Parpol-Prabowo Tak Baik,Wakil Ketua Umum (Waketum) PAN Saleh Partaonan Daulay menanggapi terkait pertemuan Presiden Prabowo Subianto dengan para ketua umum partai politik (parpol) Koalisi Indonesia Maju (KIM) Plus,1,0,1,3
2025-07-22,https://news.detik.com/dw/d-8023555/dukungan-ke-partai-sayap-kanan-meningkat-babak-baru-politik-jepang,"Dukungan ke Partai Sayap Kanan Meningkat, Babak Baru Politik Jepang?",Koalisi pemerintahan Jepang yang dipimpin oleh Perdana Menteri (PM) Shigeru Ishiba kehilangan kursi mayoritas di parlemen dalam pemilu pada Minggu (20/07) setelah partai-partai populis sayap kanan meraih banyak suara,1,0,1,3
2024-09-24,https://news.detik.com/pilkada/d-7556548/khofifah-emil-ajak-masyarakat-terapkan-politik-santun,Khofifah-Emil Ajak Masyarakat  Terapkan Politik Santun,"Pasangan Calon Gubernur dan Wakil Gubernur Jawa Timur nomor urut 2, Khofifah Indar Parawansa-Emil Elestianto Dardak mengajak seluruh masyarakat baik pendukung, relawan, simpatisan menerapkan politik santun",1,0,0,2
2025-04-14,https://news.detik.com/berita/d-7868715/mentrans-tekankan-kemandirian-ekonomi-nasional-di-tengah-isu-geopolitik,Mentrans Tekankan Kemandirian Ekonomi Nasional di Tengah Isu Geopolitik,Menteri Transmigrasi Iftitah Sulaiman menekankan pentingnya kemandirian ekonomi nasional di tengah situasi geopolitik yang serba tidak pasti,1,1,1,7
2025-04-17,https://news.detik.com/berita/d-7874087/bamsoet-dukung-jimly-award-dan-bicara-pentingnya-perbaikan-partai-politik,Bamsoet Dukung Jimly Award dan Bicara Pentingnya Perbaikan Partai Politik,"Wakil Ketua Umum Partai Golkar sekaligus anggota DPR RI, Bambang Soesatyo (Bamsoet) menyatakan dukungannya terhadap peluncuran Jimly Award yang digagas oleh Jimly School of Law and Government",1,0,0,2
2025-07-30,https://news.detik.com/berita/d-8036579/penting-ini-mitigasi-tsunami-sebelum-saat-dan-sesudah-bencana,"Penting! Ini Mitigasi Tsunami Sebelum, Saat, dan Sesudah Bencana",Mitigasi adalah upaya untuk mengurangi risiko bencana alam,0,0,0,0
2024-10-10,https://news.detik.com/berita/d-7581013/apakah-bikin-perjanjian-dalam-bahasa-asing-jadi-batal-demi-hukum,Apakah Bikin Perjanjian dalam Bahasa Asing Jadi Batal demi Hukum?,Era globalisasi memudahkan orang berkomunikasi dengan bermacam bahasa,0,0,0,0
2025-07-17,https://news.detik.com/berita/d-8016334/tolak-ubah-rp-1-000-jadi-rp-1-mk-harus-dilakukan-pembentuk-uu,"Tolak Ubah Rp 1.000 Jadi Rp 1, MK: Harus Dilakukan Pembentuk UU",Mahkamah Konstitusi (MK) menolak gugatan yang meminta redenominasi atau penyederhanaan rupiah dari Rp 1,0,1,0,4
2024-11-03,https://news.detik.com/berita/d-7619649/ahmad-luthfi-ajak-warga-kampanyekan-politik-gembira-tak-usah-bertengkar,Ahmad Luthfi Ajak Warga Kampanyekan Politik Gembira: Tak Usah Bertengkar,"Calon Gubernur Jawa Tengah (Jateng) nomor urut 2, Ahmad Luthfi menyambangi Desa Trangsen, Kecamatan Gatak, Kabupaten Sukoharjo untuk melepas jalan sehat pagi ini",0,0,0,0
2024-09-09,https://news.detik.com/berita/d-7532277/ahy-checks-and-balances-tetap-diperlukan-untuk-stabilitas-politik,AHY: Checks and Balances Tetap Diperlukan untuk Stabilitas Politik,"Ketua Umum Partai Demokrat Agus Harimurti Yudhoyono (AHY) menyerahkan sepenuhnya kepada presiden terpilih Prabowo Subianto terkait susunan pemerintahan, termasuk potensi mengajak rival politik",1,0,1,3
2024-11-23,https://news.detik.com/pilkada/d-7652777/hasil-survei-charta-politik-dedie-jenal-menang-di-semua-kecamatan,Hasil Survei Charta Politik: Dedie-Jenal Menang di Semua Kecamatan,Pemilihan Kepala Daerah (Pilkada) Kota Bogor akan berlangsung pekan depan,0,0,0,0
2024-10-08,https://news.detik.com/berita/d-7577616/hakim-di-dpr-kami-berjibaku-dengan-hukum-tapi-digaji-tanpa-dasar-hukum,"Hakim di DPR: Kami Berjibaku dengan Hukum, tapi Digaji Tanpa Dasar Hukum","Hakim Pengadilan Agama Tanjung Pandan, Jusran Ipandi, mengatakan hakim saat ini digaji tanpa dasar hukum",0,1,0,4
2024-12-19,https://news.detik.com/berita/d-7694888/ketua-ampi-usul-ada-uu-lobi-golkar-berat-kita-penuh-kepura-puraan,"Ketua AMPI Usul Ada UU Lobi, Golkar: Berat, Kita Penuh Kepura-puraan",Ketua Umum DPP AMPI Jerry Sambuaga mengusulkan adanya UU yang mengatur tentang lobi dalam pemilu,1,0,0,2
2025-07-25,https://news.detik.com/berita/d-8029221/hal-memberatkan-vonis-3-5-tahun-penjara-sekjen-pdip-hasto-kristiyanto,"Hal Memberatkan Vonis 3,5 Tahun Penjara Sekjen PDIP Hasto Kristiyanto","Sekjen PDIP Hasto Kristiyanto divonis 3,5 tahun penjara dalam kasus suap pergantian antarwaktu (PAW) anggota DPR untuk Harun Masiku",1,1,0,6
2024-11-09,https://news.detik.com/pilkada/d-7630018/cabup-pandeglang-nomor-2-diduga-lakukan-politik-uang-bawaslu-telusuri,"Cabup Pandeglang Nomor 2 Diduga Lakukan Politik Uang, Bawaslu Telusuri","Calon Bupati Pandeglang nomor urut 2, Raden Dewi Setiani, diduga melakukan tindakan money politics atau politik uang",1,0,0,2
2024-12-29,https://news.detik.com/berita/d-7708211/perayaan-natal-nasional-prabowo-ingatkan-pentingnya-hidup-rukun,"Perayaan Natal Nasional, Prabowo Ingatkan Pentingnya Hidup Rukun",Presiden Prabowo Subianto mengajak seluruh warga Indonesia untuk tetap menjaga kerukunan antar umat beragama dan suku,1,0,1,3
2024-10-16,https://news.detik.com/berita/d-7590937/mk-tolak-perluas-siapa-saja-yang-dilarang-lakukan-politik-uang-di-uu-pemilu,MK Tolak Perluas Siapa Saja yang Dilarang Lakukan Politik Uang di UU Pemilu,Mahkamah Konstitusi (MK) menolak memperluas subjek hukum terkait larangan politik uang dalam Undang-Undang Pemilu,1,1,0,6
2025-06-05,https://news.detik.com/kolom/d-7949880/qurban-dari-ibadah-pribadi-ke-agenda-keadilan-pangan-nasional,Qurban: Dari Ibadah Pribadi ke Agenda Keadilan Pangan Nasional,"Setiap kali Idul Adha tiba, jutaan umat Islam berduyun-duyun menjalankan ibadah kurban sebagai wujud ketaatan kepada Allah dan kepedulian sosial kepada sesama",0,0,0,0
2025-05-30,https://news.detik.com/berita/d-7940903/pimpinan-kpk-usul-ruu-kuhap-atur-penyelidik-penyidik-lulusan-sarjana-hukum,Pimpinan KPK Usul RUU KUHAP Atur Penyelidik-Penyidik Lulusan Sarjana Hukum,Wakil Ketua KPK Johanis Tanak mengusulkan Rancangan Undang-Undang tentang Perubahan atas Undang-Undang Nomor 8 Tahun 1981 tentang Hukum Acara Pidana (RUU KUHAP) mengatur soal syarat penyelidik dan penyidik,0,1,0,4
2025-01-07,https://news.detik.com/berita/d-7721263/menteri-hukum-kaji-putusan-mk-hapus-presidential-threshold-20,Menteri Hukum Kaji Putusan MK Hapus Presidential Threshold 20%,Menteri Hukum Supratman Andi Agtas mengatakan pihaknya telah memerintahkan Direktorat Jenderal Peraturan Perundangan untuk melakukan kajian atas putusan Mahkamah Konstitusi (MK) yang menghapus ambang batas atau persyaratan pencalonan presiden dan wakil presiden atau presidential threshold,1,1,0,6
2025-06-25,https://news.detik.com/berita/d-7981962/komjak-sebut-kuhap-baru-bakal-ubah-sistem-hukum-ri-bukan-tambal-sulam-pasal,Komjak Sebut KUHAP Baru Bakal Ubah Sistem Hukum RI: Bukan Tambal Sulam Pasal,Pembahasan RUU KUHAP (Kitab Undang-Undang Hukum Acara Pidana) terus dilakukan,0,1,0,4
2025-04-22,https://news.detik.com/berita/d-7879595/bahlil-sebut-misbakhun-sosok-pemenang-pernah-dapat-cobaan-hukum,Bahlil Sebut Misbakhun Sosok Pemenang: Pernah Dapat Cobaan Hukum,Ketua Umum Partai Golkar Bahlil Lahadalia sempat kembali menyapa kadernya Mukhamad Misbakhun yang pernah disinggungnya beberapa saat lalu di acara Partai Golkar,1,0,0,2
2024-11-22,https://news.detik.com/berita/d-7652088/waka-mpr-dorong-penguatan-ekosistem-kebudayaan-nasional,Waka MPR Dorong Penguatan Ekosistem Kebudayaan Nasional,"Wakil Ketua MPR RI Lestari Moerdijat mengatakan upaya memperkuat ekosistem kebudayaan dengan mengajak para pelaku budaya, seniman, dan masyarakat merupakan langkah strategis dalam proses pemajuan kebudayaan nasional serta menjaga keberagaman budaya bangsa",0,0,1,1
2024-10-16,https://news.detik.com/pilkada/d-7590308/bawaslu-pria-viral-bagikan-duit-di-pandeglang-tak-lakukan-politik-uang,Bawaslu: Pria Viral Bagikan Duit di Pandeglang Tak Lakukan Politik Uang,Badan Pengawas Pemilu (Bawaslu) Pandeglang telah selesai menangani laporan dugaan politik uang yang dilakukan oleh pria di Kecamatan Cimanuk,1,0,0,2
2025-07-28,https://news.detik.com/berita/d-8033736/cak-imin-usul-gubernur-dipilih-pusat-bahlil-golkar-bicara-itu-duluan,"Cak Imin Usul Gubernur Dipilih Pusat, Bahlil: Golkar Bicara Itu Duluan",Ketua Umum (Ketum) Golkar Bahlil Lahadalia menanggapi usulan Ketum PKB Muhaimin Iskandar atau Cak Imin agar pemilihan kepala daerah tak digelar secara langsung dengan gubernur yang dipilih oleh pemerintah pusat,1,0,1,3
2025-04-19,https://news.detik.com/berita/d-7875794/12-orang-diduga-politik-uang-bawaslu-ri-awasi-langsung-psu-kabupaten-serang,"12 Orang Diduga Politik Uang, Bawaslu RI Awasi Langsung PSU Kabupaten Serang","Anggota Bawaslu RI, Puadi, mengawasi langsung pelaksanaan pemungutan suara ulang (PSU) di Kabupaten Serang, Banten",1,0,0,2
2024-12-06,https://news.detik.com/foto-news/d-7674461/istri-thomas-lembong-minta-perlindungan-komnas-ham,Istri Thomas Lembong Minta Perlindungan Komnas HAM,"Jakarta - Istri Thomas Lembong, Ciska Wihardja mengadu ke Komnas HAM",0,0,0,0
2025-07-25,https://news.detik.com/berita/d-8029269/respons-istri-usai-sekjen-pdip-hasto-divonis-3-5-tahun-penjara,"Respons Istri Usai Sekjen PDIP Hasto Divonis 3,5 Tahun Penjara","Sekjen PDIP Hasto Kristiyanto divonis 3,5 tahun penjara dalam kasus suap pengurusan pergantian antarwaktu (PAW) anggota DPR untuk Harun Masiku",1,1,0,6
2025-05-20,https://news.detik.com/kolom/d-7922252/kebangkitan-nasional-di-7-bulan-pemerintahan-prabowo-gibran,Kebangkitan Nasional di 7 Bulan Pemerintahan Prabowo - Gibran,Tujuh bulan telah berlalu sejak Presiden Prabowo Subianto dan Wakil Presiden Gibran Rakabuming Raka resmi mengemban amanah memimpin pemerintahan Indonesia,1,0,1,3
2024-10-11,https://news.detik.com/berita/d-7583722/terima-salim-segaf-dkk-prabowo-terkenang-segajah-dengan-pks,"Terima Salim Segaf dkk, Prabowo Terkenang 'Segajah' dengan PKS","Petinggi PKS yang dipimpin oleh Ketua Majelis Syuro PKS Salim Segaf Aljufri mengunjungi kediaman presiden terpilih Prabowo Subianto di Jl Kertanegara No 4, Jakarta Selatan",1,0,1,3
2025-01-17,https://news.detik.com/berita/d-7736723/demokrat-gelar-natal-nasional-21-januari-undang-petinggi-pemerintah-partai,"Demokrat Gelar Natal Nasional 21 Januari, Undang Petinggi Pemerintah-Partai",Partai Demokrat bakal melaksanakan perayaan Natal Nasional pada Selasa (21/1),1,0,1,3
2025-02-21,https://news.detik.com/internasional/d-7788849/iran-hukum-gantung-975-orang-pada-2024,Iran Hukum Gantung 975 Orang pada 2024,Otoritas Iran telah mengeksekusi mati sedikitnya 975 orang sepanjang tahun 2024 lalu,0,0,0,0
2024-09-12,https://news.detik.com/foto-news/d-7537295/mk-tolak-gugatan-novel-baswedan-soal-syarat-usia-pimpinan-kpk,MK Tolak Gugatan Novel Baswedan Soal Syarat Usia Pimpinan KPK,Jakarta - MK menolak permohonan uji materi soal syarat usia pimpinan KPK yang diajukan oleh Novel Baswedan,0,0,0,0
2024-10-18,https://news.detik.com/foto-news/d-7593635/jaksa-agung-dinobatkan-sebagai-tokoh-penegak-hukum-humanis,Jaksa Agung Dinobatkan sebagai Tokoh Penegak Hukum Humanis,Jakarta - Jaksa Agung ST Burhanuddin meraih detikcom Awards 2024 kategori Tokoh Penegak Hukum Humanis,0,1,0,4
2024-11-19,https://news.detik.com/berita/d-7645848/pedoman-penyelenggaraan-kegiatan-bulan-guru-nasional-2024,Pedoman Penyelenggaraan Kegiatan Bulan Guru Nasional 2024,Kegiatan Bulan Guru Nasional diselenggarakan dalam rangka memperingati Hari Guru Nasional 2024,0,0,1,1
2025-05-13,https://news.detik.com/berita/d-7912186/kakorlantas-polri-bentuk-tim-penegakan-hukum-menuju-zero-over-dimension-overload,Kakorlantas Polri Bentuk Tim Penegakan Hukum Menuju Zero Over Dimension Overload,Kakorlantas Polri Irjen Agus Suryonugroho membentuk Tim Penegakan Hukum Kelebihan Dimensi dan Muatan (KDM) Nasional,0,0,1,1
2025-04-25,https://news.detik.com/berita/d-7884984/jaksa-segera-tetapkan-tersangka-kasus-korupsi-proyek-pusat-data-nasional,Jaksa Segera Tetapkan Tersangka Kasus Korupsi Proyek Pusat Data Nasional,Kejaksaan Negeri Jakarta Pusat (Kejari Jakpus) mengaku segera menetapkan tersangka dalam kasus dugaan korupsi terkait Pusat Data Nasional Sementara (PDNS) Kementerian Komunikasi dan Informatika (Kominfo) 2020 hingga 2024,1,1,1,7
2025-06-03,https://news.detik.com/berita/d-7945496/tentang-muzdalifah-dan-hukum-melakukan-murur-bagi-jemaah-haji,Tentang Muzdalifah dan Hukum Melakukan Murur bagi Jemaah Haji,Bermalam atau mabit di Muzdalifah menjadi salah satu proses yang harus dilakukan jemaah haji,0,0,0,0
2024-10-08,https://news.detik.com/foto-news/d-7577703/begini-suasana-sidang-gugatan-rp-5-246-t-habib-rizieq-ke-jokowi,Begini Suasana Sidang Gugatan Rp 5.246 T Habib Rizieq ke Jokowi,Jakarta - Sidang gugatan perdata Rp 5,0,1,0,4
2025-01-10,https://news.detik.com/berita/d-7726204/guru-supriyani-gagal-jadi-pppk-kuasa-hukum-singgung-janji-mendikdasmen,"Guru Supriyani Gagal Jadi PPPK, Kuasa Hukum Singgung Janji Mendikdasmen","Guru honorer Supriyani di Konawe Selatan, Sulawesi Tenggara (Sultra), gagal lolos dalam seleksi pegawai pemerintah dengan perjanjian kerja (PPPK)",0,0,1,1
2025-07-25,https://news.detik.com/berita/d-8029103/hakim-hasto-aktif-di-paw-harun-masiku-garansi-saya-perintah-ibu-jadi-bukti,"Hakim: Hasto Aktif di PAW Harun Masiku, 'Garansi Saya-Perintah Ibu' Jadi Bukti","Majelis hakim menyatakan Sekjen PDIP Hasto Kristiyanto tetap mengupayakan pergantian antarwaktu (PAW) anggota DPR untuk Harun Masiku meski kader PDIP, Riezky Aprilia, sudah dilantik sebagai anggota DPR",1,1,0,6
